{
  "lineage_id": "LIN-001",
  "leakage_group_id": "GRP-001",
  "dataset": "objaverse",
  "source_uid": "uid-001",
  "source_uri": "drive://private/object.glb",
  "source_path": "/private/object.glb",
  "creator_group": "creator-001",
  "category": "chair",
  "selection_stratum": "objaverse",
  "complexity_quantile": 4,
  "source_sha256": "aaaaaaaaaaaaaaaaaaaaaaaaaaaaaaaaaaaaaaaaaaaaaaaaaaaaaaaaaaaaaaaa",
  "source_size_bytes": 1024,
  "source_format": "glb",
  "format_status": "P2A_AUDITED_SUPPORTED",
  "licence": "CC-BY-4.0",
  "licence_status": "LAWFUL_INTERNAL_USE",
  "eligibility": "ELIGIBLE",
  "topology_status": "V",
  "forced_split": null,
  "split": "development",
  "blind_scope": "NONE",
  "bbox": [0.0, 0.0, 0.0, 1.0, 1.0, 1.0]
}
